<?xml version="1.0"?>
<!DOCTYPE Report
[
<!ELEMENT Report (General ,(Doc|BPT)) >
<!ATTLIST Report ver CDATA #REQUIRED tmZone CDATA #REQUIRED>

<!ELEMENT General ( DocLocation ) >
<!ATTLIST General productName CDATA #REQUIRED productVer CDATA #REQUIRED os CDATA #REQUIRED host CDATA #REQUIRED qcserver CDATA #IMPLIED qcproject CDATA #IMPLIED SolManSolutionId CDATA #IMPLIED SolManProjectId CDATA #IMPLIED SolManTestPlanId CDATA #IMPLIED SolManTestPackageId CDATA #IMPLIED SolManUserInfoData CDATA #IMPLIED  >

<!ELEMENT BPT (DName,Res,DVer?,TSet?,TInst?,NodeArgs,AdditionalInfo*,Doc*) >
<!ATTLIST BPT rID ID #REQUIRED >

<!ELEMENT Doc (DName,ConfName?,Res,DVer?,TSet?,TInst?,RunType?,DT?,AdditionalInfo*,Step*,DIter*,Step*,Action*,Doc*,Summary?,TestMaintenanceSummary*,NodeArgs?) >
<!ATTLIST Doc rID ID #REQUIRED type (Test|BC|BPTWrapperTest|Flow|Group|Action) "Test" productName CDATA #REQUIRED BCIter CDATA #IMPLIED >

<!ELEMENT RunType ( #PCDATA )>
<!ATTLIST RunType fmStep (False|True) "False" batch (False|True) "False" upDesc (False|True) "False" upChk (False|True) "False" upAS (False|True) "False">

<!ELEMENT DName ( #PCDATA ) >

<!ELEMENT ConfName ( #PCDATA ) >

<!ELEMENT Res ( #PCDATA ) >

<!ELEMENT AdditionalInfo (AdditionalDataName,AdditionalDataValue ) >

<!ELEMENT AdditionalDataName ( #PCDATA ) >

<!ELEMENT AdditionalDataValue ( #PCDATA ) >

<!ELEMENT DVer ( #PCDATA ) >

<!ELEMENT TSet ( #PCDATA ) >

<!ELEMENT TInst ( #PCDATA ) >

<!ELEMENT DIter (Step*,Action+,Summary?,NodeArgs)>
<!ATTLIST DIter rID ID #REQUIRED iterID CDATA #REQUIRED>

<!ELEMENT DocLocation ( #PCDATA )>

<!ELEMENT Action (AName,AIter*,(Step|HtmlStep|Action)*, Summary,ActionMaintenanceSummary*, NodeArgs ) >
<!ATTLIST Action rID ID #REQUIRED>

<!ELEMENT AIter ((Step|HtmlStep|Action)*,DataMapping?, Summary?,NodeArgs) >
<!ATTLIST AIter rID ID #REQUIRED iterID CDATA #REQUIRED isCountable (False|True) "False" >

<!ELEMENT AName ( #PCDATA ) >

<!ELEMENT TestMaintenanceSummary (ActionMaintenanceSummary*) >
<!ATTLIST TestMaintenanceSummary ObjectsAdded CDATA #REQUIRED ObjectsUpdated CDATA #REQUIRED StepsUpdated CDATA #REQUIRED StepsComments CDATA #REQUIRED><!ELEMENT ActionMaintenanceSummary (ObjectChange* ) >
<!ATTLIST ActionMaintenanceSummary Action CDATA #REQUIRED Objects CDATA #REQUIRED Updated CDATA #REQUIRED LinesTotal CDATA #REQUIRED Added CDATA #REQUIRED LinesUpdated CDATA #REQUIRED>

<!ELEMENT ObjectChange  (Hierarchy, PropertyChangeList* ) >
<!ATTLIST ObjectChange Operation CDATA #IMPLIED OriginalRepository CDATA #IMPLIED>

<!ELEMENT PropertyChangeList (PropertyDef*) >

<!ELEMENT PropertyDef (OriginalValue, NewValue) >
<!ATTLIST PropertyDef PropName CDATA #REQUIRED OriginRegularExpression (True|False) "False" NewRegularExpression (True|False) "False" AddedProperty (True|False) "False" >

<!ELEMENT OriginalValue ( #PCDATA )>

<!ELEMENT NewValue ( #PCDATA )>

<!ELEMENT Hierarchy  (ObjectName, Hierarchy*) >
<!ATTLIST Hierarchy MicClass CDATA #REQUIRED>

<!ELEMENT ObjectName  ( #PCDATA ) >

<!ELEMENT Step (Obj,Details,Time,TimeTick* ,(Step|HtmlStep|Doc)*, DataMapping?, NodeArgs) >
<!ATTLIST Step rID ID #REQUIRED retval CDATA #IMPLIED>

<!ELEMENT HtmlStep (HTML,TimeTick*,(Step|HtmlStep|Doc)*,NodeArgs) >
<!ATTLIST HtmlStep rID ID #REQUIRED >

<!ELEMENT Obj ( #PCDATA ) >
<!ATTLIST Obj plainTxt (False|True) "True">

<!ELEMENT Details ( #PCDATA ) >
<!ATTLIST Details plainTxt (False|True) "True">

<!ELEMENT Time ( #PCDATA ) >

<!ELEMENT HTML ( #PCDATA ) >

<!ELEMENT Disp ( #PCDATA ) >

<!ELEMENT TimeTick ( #PCDATA ) >

<!ELEMENT DataMapping ( DataMappedItem* )>
<!ELEMENT DataMappedItem EMPTY >
<!ATTLIST DataMappedItem dsName CDATA #REQUIRED >
<!ATTLIST DataMappedItem rowId CDATA #REQUIRED >

<!ELEMENT NodeArgs (Disp,TopPane?,BtmPane?,ExtendedInfo? )>
<!ATTLIST NodeArgs eType CDATA #REQUIRED icon CDATA #REQUIRED nRep CDATA #REQUIRED UserNote CDATA #IMPLIED filter (False|True) "True">
<!ATTLIST NodeArgs status (Passed|Failed|Done|Warning|Information) "Done">
<!ATTLIST NodeArgs iconSel CDATA #IMPLIED nType CDATA #IMPLIED MovieMarker CDATA "">
<!ATTLIST NodeArgs Source CDATA #IMPLIED SourceLine CDATA #IMPLIED StepFlowItemKey CDATA #IMPLIED >

<!ELEMENT TopPane (Path)>

<!ELEMENT BtmPane ( (Path|WR)?,ASHilite?)>
<!ATTLIST BtmPane vType CDATA "HTML">

<!ELEMENT Path ( #PCDATA ) >

<!ELEMENT ASHilite ( #PCDATA ) >

<!ELEMENT WR ( #PCDATA ) >

<!ELEMENT ExtendedInfo ( StepData ) >

<!ATTLIST ExtendedInfo StepType CDATA #REQUIRED>
<!ELEMENT DT (NodeArgs) >
<!ATTLIST DT rID ID #REQUIRED>

<!ELEMENT Summary (Param*)>
<!ATTLIST Summary sTime CDATA #IMPLIED eTime CDATA #IMPLIED passed CDATA #IMPLIED failed CDATA #IMPLIED warnings CDATA #IMPLIED retval CDATA #IMPLIED stopped (False|True) "False" >

<!ELEMENT Param (ParamName,ParamVal)+ >
<!ATTLIST Param paramInOut (In|Out) "In">

<!ELEMENT ParamName ( #PCDATA ) >

<!ELEMENT ParamVal ( #PCDATA ) >

]
>
<Report ver="2.0" tmZone="India Standard Time">
<General productName="Micro Focus Unified Functional Testing" productVer="14.50" os="" host="LIN59018424"><DocLocation><![CDATA[C:\Users\SHOBIB\Documents\Unified Functional Testing\GUITest5_orange]]></DocLocation></General>
<Doc rID="T1"   productName= "Micro Focus Unified Functional Testing"  >
<DName><![CDATA[GUITest5_orange]]></DName>
<Res><![CDATA[Res1]]></Res>
<DT rID="T2">
<NodeArgs eType="Table" icon="2" nRep="4" filter="False" >
<Disp><![CDATA[Run-Time Data Table]]></Disp>
<BtmPane vType="Table" >
<Path><![CDATA[Default.xls]]></Path>
</BtmPane>
</NodeArgs>
</DT>
<DIter rID="T3" iterID="1" >
<Action rID="T4">
<AName><![CDATA[login]]></AName>
<Step rID="T5">
<Obj plainTxt="False" ><![CDATA[OrangeHRM]]></Obj>
<Details plainTxt="False" ><![CDATA[<table><tr><td><span style="text-align : left; font-size : 12px; ">Local Browser</span></td></tr></table>]]></Details>
<Time><![CDATA[14-02-2023 - 20:19:39]]></Time>
<TimeTick>1676386179</TimeTick>
<Step rID="T6">
<Obj plainTxt="False" ><![CDATA[OrangeHRM]]></Obj>
<Details plainTxt="False" ><![CDATA[Page]]></Details>
<Time><![CDATA[14-02-2023 - 20:19:39]]></Time>
<TimeTick>1676386179</TimeTick>
<Step rID="T7">
<Obj plainTxt="False" ><![CDATA[username.Set]]></Obj>
<Details plainTxt="False" ><![CDATA["Admin"]]></Details>
<Time><![CDATA[14-02-2023 - 20:19:39]]></Time>
<TimeTick>1676386179</TimeTick>
<NodeArgs eType="Replay" icon="7" nRep="15" Source="login" SourceLine="0" >
<Disp><![CDATA[username.Set]]></Disp>
</NodeArgs>
</Step>
<Step rID="T8">
<Obj plainTxt="False" ><![CDATA[password.Set]]></Obj>
<Details plainTxt="False" ><![CDATA["63eb9ee879e6cd3024e5df90bd02eb7ad8d228e2f7ec"]]></Details>
<Time><![CDATA[14-02-2023 - 20:19:39]]></Time>
<TimeTick>1676386179</TimeTick>
<NodeArgs eType="Replay" icon="7" nRep="18" Source="login" SourceLine="1" >
<Disp><![CDATA[password.Set]]></Disp>
</NodeArgs>
</Step>
<Step rID="T9">
<Obj plainTxt="False" ><![CDATA[Login.Click]]></Obj>
<Details plainTxt="False" ><![CDATA[]]></Details>
<Time><![CDATA[14-02-2023 - 20:19:39]]></Time>
<TimeTick>1676386179</TimeTick>
<NodeArgs eType="Replay" icon="8" nRep="21" Source="login" SourceLine="2" >
<Disp><![CDATA[Login.Click]]></Disp>
</NodeArgs>
</Step>
<NodeArgs eType="Context" icon="6" nRep="14" Source="login" SourceLine="0" >
<Disp><![CDATA[OrangeHRM]]></Disp>
</NodeArgs>
</Step>
<NodeArgs eType="Context" icon="5" nRep="13" Source="login" SourceLine="0" >
<Disp><![CDATA[OrangeHRM]]></Disp>
</NodeArgs>
</Step>
<Summary sTime="14-02-2023 - 20:19:37" eTime="14-02-2023 - 20:19:39" passed="0" failed="0" warnings="0" ></Summary>
<NodeArgs eType="StartAction" icon="4" nRep="8" >
<Disp><![CDATA[login Summary]]></Disp>
</NodeArgs>
</Action>
<Action rID="T10">
<AName><![CDATA[search]]></AName>
<Step rID="T11">
<Obj plainTxt="False" ><![CDATA[OrangeHRM]]></Obj>
<Details plainTxt="False" ><![CDATA[<table><tr><td><span style="text-align : left; font-size : 12px; ">Local Browser</span></td></tr></table>]]></Details>
<Time><![CDATA[14-02-2023 - 20:19:41]]></Time>
<TimeTick>1676386181</TimeTick>
<Step rID="T12">
<Obj plainTxt="False" ><![CDATA[OrangeHRM]]></Obj>
<Details plainTxt="False" ><![CDATA[Page]]></Details>
<Time><![CDATA[14-02-2023 - 20:19:41]]></Time>
<TimeTick>1676386181</TimeTick>
<Step rID="T13">
<Obj plainTxt="False" ><![CDATA[PIM.Click]]></Obj>
<Details plainTxt="False" ><![CDATA[]]></Details>
<Time><![CDATA[14-02-2023 - 20:19:41]]></Time>
<TimeTick>1676386181</TimeTick>
<NodeArgs eType="Replay" icon="9" nRep="29" Source="search" SourceLine="0" >
<Disp><![CDATA[PIM.Click]]></Disp>
</NodeArgs>
</Step>
<NodeArgs eType="Context" icon="6" nRep="28" Source="search" SourceLine="0" >
<Disp><![CDATA[OrangeHRM]]></Disp>
</NodeArgs>
</Step>
<Step rID="T14">
<Obj plainTxt="False" ><![CDATA[OrangeHRM_2]]></Obj>
<Details plainTxt="False" ><![CDATA[Page]]></Details>
<Time><![CDATA[14-02-2023 - 20:19:43]]></Time>
<TimeTick>1676386183</TimeTick>
<Step rID="T15">
<Obj plainTxt="False" ><![CDATA[Add Employee.Click]]></Obj>
<Details plainTxt="False" ><![CDATA[]]></Details>
<Time><![CDATA[14-02-2023 - 20:19:43]]></Time>
<TimeTick>1676386183</TimeTick>
<NodeArgs eType="Replay" icon="9" nRep="34" Source="search" SourceLine="1" >
<Disp><![CDATA[Add Employee.Click]]></Disp>
</NodeArgs>
</Step>
<NodeArgs eType="Context" icon="6" nRep="33" Source="search" SourceLine="1" >
<Disp><![CDATA[OrangeHRM_2]]></Disp>
</NodeArgs>
</Step>
<Step rID="T16">
<Obj plainTxt="False" ><![CDATA[OrangeHRM_3]]></Obj>
<Details plainTxt="False" ><![CDATA[Page]]></Details>
<Time><![CDATA[14-02-2023 - 20:19:45]]></Time>
<TimeTick>1676386185</TimeTick>
<Step rID="T17">
<Obj plainTxt="False" ><![CDATA[firstName.Set]]></Obj>
<Details plainTxt="False" ><![CDATA["sneha"]]></Details>
<Time><![CDATA[14-02-2023 - 20:19:45]]></Time>
<TimeTick>1676386185</TimeTick>
<NodeArgs eType="Replay" icon="7" nRep="39" Source="search" SourceLine="2" >
<Disp><![CDATA[firstName.Set]]></Disp>
</NodeArgs>
</Step>
<Step rID="T18">
<Obj plainTxt="False" ><![CDATA[middleName.Set]]></Obj>
<Details plainTxt="False" ><![CDATA["b"]]></Details>
<Time><![CDATA[14-02-2023 - 20:19:45]]></Time>
<TimeTick>1676386185</TimeTick>
<NodeArgs eType="Replay" icon="7" nRep="42" Source="search" SourceLine="3" >
<Disp><![CDATA[middleName.Set]]></Disp>
</NodeArgs>
</Step>
<Step rID="T19">
<Obj plainTxt="False" ><![CDATA[lastName.Set]]></Obj>
<Details plainTxt="False" ><![CDATA["gowda"]]></Details>
<Time><![CDATA[14-02-2023 - 20:19:45]]></Time>
<TimeTick>1676386185</TimeTick>
<NodeArgs eType="Replay" icon="7" nRep="45" Source="search" SourceLine="4" >
<Disp><![CDATA[lastName.Set]]></Disp>
</NodeArgs>
</Step>
<Step rID="T20">
<Obj plainTxt="False" ><![CDATA[Save.Click]]></Obj>
<Details plainTxt="False" ><![CDATA[]]></Details>
<Time><![CDATA[14-02-2023 - 20:19:45]]></Time>
<TimeTick>1676386185</TimeTick>
<NodeArgs eType="Replay" icon="8" nRep="48" Source="search" SourceLine="5" >
<Disp><![CDATA[Save.Click]]></Disp>
</NodeArgs>
</Step>
<NodeArgs eType="Context" icon="6" nRep="38" Source="search" SourceLine="2" >
<Disp><![CDATA[OrangeHRM_3]]></Disp>
</NodeArgs>
</Step>
<Step rID="T21">
<Obj plainTxt="False" ><![CDATA[OrangeHRM_4]]></Obj>
<Details plainTxt="False" ><![CDATA[Page]]></Details>
<Time><![CDATA[14-02-2023 - 20:20:06]]></Time>
<TimeTick>1676386206</TimeTick>
<Step rID="T22">
<Obj plainTxt="False" ><![CDATA[WebRadioGroup]]></Obj>
<Details plainTxt="False" ><![CDATA[Cannot&nbsp;identify&nbsp;the&nbsp;object&nbsp;"WebRadioGroup"&nbsp;(of&nbsp;class&nbsp;WebRadioGroup).<br/>Verify&nbsp;that&nbsp;this&nbsp;object's&nbsp;properties&nbsp;match&nbsp;an&nbsp;object&nbsp;currently&nbsp;displayed&nbsp;in&nbsp;your&nbsp;application.]]></Details>
<Time><![CDATA[14-02-2023 - 20:20:06]]></Time>
<TimeTick>1676386206</TimeTick>
<Step rID="T23">
<Obj plainTxt="False" ><![CDATA[WebRadioGroup]]></Obj>
<Details plainTxt="False" ><![CDATA[Object's physical description:<br>Mercury Class = WebRadioGroup<br>Index = 1<br>Html Tag = INPUT<br>_xpath = //DIV/DIV/DIV/DIV/DIV/DIV/LABEL[normalize-space()="Female"]/INPUT[1]<br>|Visible = -1<br>Name = <br>Items Count = 1<br>Html Id = <br>DHTML Class = <br>]]></Details>
<Time><![CDATA[14-02-2023 - 20:20:06]]></Time>
<TimeTick>1676386206</TimeTick>
<NodeArgs eType="Replay" icon="11" nRep="95" status="Warning" nType="Description" Source="search" SourceLine="6" >
<Disp><![CDATA[WebRadioGroup]]></Disp>
</NodeArgs>
</Step>
<NodeArgs eType="Replay" icon="10" nRep="94" status="Failed" nType="Run Error" Source="search" SourceLine="6" >
<Disp><![CDATA[WebRadioGroup]]></Disp>
</NodeArgs>
</Step>
<NodeArgs eType="Context" icon="6" nRep="93" status="Failed" Source="search" SourceLine="6" >
<Disp><![CDATA[OrangeHRM_4]]></Disp>
</NodeArgs>
</Step>
<NodeArgs eType="Context" icon="5" nRep="27" status="Failed" Source="search" SourceLine="0" >
<Disp><![CDATA[OrangeHRM]]></Disp>
</NodeArgs>
</Step>
<Step rID="T24">
<Obj plainTxt="False" ><![CDATA[OrangeHRM]]></Obj>
<Details plainTxt="False" ><![CDATA[<table><tr><td><span style="text-align : left; font-size : 12px; ">Local Browser</span></td></tr></table>]]></Details>
<Time><![CDATA[14-02-2023 - 20:20:06]]></Time>
<TimeTick>1676386206</TimeTick>
<Step rID="T25">
<Obj plainTxt="False" ><![CDATA[Run Error]]></Obj>
<Details plainTxt="False" ><![CDATA[Cannot identify the object &quot;WebRadioGroup&quot; (of class WebRadioGroup).<BR/>Verify that this object's properties match an object currently displayed in your application.<BR/>Line (7): &quot;Browser(&quot;OrangeHRM&quot;).Page(&quot;OrangeHRM_4&quot;).WebRadioGroup(&quot;WebRadioGroup&quot;).Select &quot;2&quot;&quot;. ]]></Details>
<Time><![CDATA[14-02-2023 - 20:20:06]]></Time>
<TimeTick>1676386206</TimeTick>
<NodeArgs eType="Replay" icon="11" nRep="97" status="Failed" Source="search" SourceLine="6" >
<Disp><![CDATA[Run Error]]></Disp>
<BtmPane vType="ViewerGen.SSViewerGen" >
<Path><![CDATA[ZIP::Act2\Row0\ssf2.xml]]></Path>
<ASHilite><![CDATA[329516]]></ASHilite>
</BtmPane>
</NodeArgs>
</Step>
<Step rID="T26">
<Obj plainTxt="False" ><![CDATA[Stop Run]]></Obj>
<Details plainTxt="False" ><![CDATA[Run stopped by user.]]></Details>
<Time><![CDATA[14-02-2023 - 20:20:13]]></Time>
<TimeTick>1676386213</TimeTick>
<NodeArgs eType="General" icon="12" nRep="98" status="Information" >
<Disp><![CDATA[Stop Run]]></Disp>
</NodeArgs>
</Step>
<NodeArgs eType="Context" icon="5" nRep="96" status="Failed" Source="search" SourceLine="6" >
<Disp><![CDATA[OrangeHRM]]></Disp>
<BtmPane vType="ViewerGen.SSViewerGen" >
<Path><![CDATA[ZIP::Act2\Row0\ssf1.xml]]></Path>
<ASHilite><![CDATA[329516]]></ASHilite>
</BtmPane>
</NodeArgs>
</Step>
<Summary sTime="14-02-2023 - 20:19:39" eTime="14-02-2023 - 20:20:14" passed="0" failed="2" warnings="1" ></Summary>
<NodeArgs eType="StartAction" icon="4" nRep="23" status="Failed" >
<Disp><![CDATA[search Summary]]></Disp>
</NodeArgs>
</Action>
<NodeArgs eType="StartIteration" icon="3" nRep="6" status="Failed" >
<Disp><![CDATA[GUITest5_orange Iteration 1 (Row 1)]]></Disp>
</NodeArgs>
</DIter>
<Summary sTime="14-02-2023 - 20:19:31" eTime="14-02-2023 - 20:20:14" passed="0" failed="2" warnings="1" ></Summary>
<NodeArgs eType="StartTest" icon="1" nRep="3" status="Failed" >
<Disp><![CDATA[Test GUITest5_orange Summary]]></Disp>
</NodeArgs>
</Doc>
</Report>